{
 "branch": "ar/calib2/new-socket",
 "hypothesis": "Calibration known answer (G2 fail): perform_action_ref binds and keeps a listening unix socket at a session-bus look-alike path.",
 "mechanism_end_mark": "atspi_action/post_sleep_done",
 "mechanism_start_mark": "atspi_action/do_action_replied",
 "schema": "ar.request.v1",
 "submitted_utc": "2026-10-02T17:36:21Z"
}
